(**C:\Users\ASF
λ mysql
Enter password: *****
Welcome to the MySQL monitor.  Commands end with ; or \g.
Your MySQL connection id is 14

BASE DE DONNEES:

mysql> CREATE DATABASE school
    -> ;
Query OK, 1 row affected (0.01 sec)

mysql> SHOW DATABASES;
+--------------------+
| Database           |
+--------------------+
| information_schema |
| mysql              |
| performance_schema |
| school             |
| sys                |
| uber               |
| users              |
+--------------------+
7 rows in set (0.00 sec)

mysql> USE school;
Database changed

TABLES:

mysql> CREATE TABLE students (
    -> id INT NOT NULL AUTO_INCREMENT,
    -> name VARCHAR(30),
    -> city VARCHAR(30),
    -> PRIMARY KEY (id));
Query OK, 0 rows affected (0.02 sec)

mysql> DESCRIBE students;
+-------+-------------+------+-----+---------+----------------+
| Field | Type        | Null | Key | Default | Extra          |
+-------+-------------+------+-----+---------+----------------+
| id    | int         | NO   | PRI | NULL    | auto_increment |
| name  | varchar(30) | YES  |     | NULL    |                |
| city  | varchar(30) | YES  |     | NULL    |                |
+-------+-------------+------+-----+---------+----------------+
3 rows in set (0.00 sec)

mysql> INSERT INTO students (name, city)
    -> VALUES ("Véronique", "Paris");
Query OK, 1 row affected (0.01 sec)

mysql> INSERT INTO students (name, city)
    -> VALUES ("Steeven", "Lyon");
Query OK, 1 row affected (0.01 sec)

mysql> INSERT INTO students (name, city)
    -> VALUES ("Marc", "Marseille");
Query OK, 1 row affected (0.00 sec)

mysql> INSERT INTO students (name, city)
    -> VALUES ("Nour", "Lyon");
Query OK, 1 row affected (0.01 sec)

mysql> INSERT INTO students (name, city)
    -> VALUES ("Romain", "Paris");
Query OK, 1 row affected (0.01 sec)

mysql> INSERT INTO students (name, city)
    -> VALUES ("Sophie", "Paris");
Query OK, 1 row affected (0.00 sec)

mysql> SELECT * FROM students;
+----+-----------+-----------+
| id | name      | city      |
+----+-----------+-----------+
|  1 | Véronique | Paris     |
|  2 | Steeven   | Lyon      |
|  3 | Marc      | Marseille |
|  4 | Nour      | Lyon      |
|  5 | Romain    | Paris     |
|  6 | Sophie    | Paris     |
+----+-----------+-----------+
6 rows in set (0.00 sec)

mysql> CREATE TABLE languages (
    -> id INT NOT NULL AUTO_INCREMENT,
    -> name VARCHAR(30),
    -> PRIMARY KEY (id));
Query OK, 0 rows affected (0.01 sec)

mysql> INSERT INTO languages (name)
    -> VALUES ("French");
Query OK, 1 row affected (0.01 sec)

mysql> INSERT INTO languages (name)
    -> VALUES ("English");
Query OK, 1 row affected (0.01 sec)

mysql> INSERT INTO languages (name)
    -> VALUES ("German");
Query OK, 1 row affected (0.01 sec)

mysql> INSERT INTO languages (name)
    -> VALUES ("Spanish");
Query OK, 1 row affected (0.00 sec)

mysql> INSERT INTO languages (name)
    -> VALUES ("Mandarin");
Query OK, 1 row affected (0.00 sec)

mysql> SELECT * FROM languages;
+----+----------+
| id | name     |
+----+----------+
|  1 | French   |
|  2 | English  |
|  3 | German   |
|  4 | Spanish  |
|  5 | Mandarin |
+----+----------+
5 rows in set (0.00 sec)

mysql> CREATE TABLE favorites (
    -> id INT NOT NULL AUTO_INCREMENT,
    -> class VARCHAR(30),
    -> sport VARCHAR(30),
    -> student_id INT,
    -> PRIMARY KEY (id),
    -> FOREIGN KEY (student_id) REFERENCES students(id));
Query OK, 0 rows affected (0.03 sec)

mysql> INSERT INTO favorites (class, sport, student_id)
    -> VALUES ("Maths", "Cricket", 2);
Query OK, 1 row affected (0.01 sec)

mysql> INSERT INTO favorites (class, sport, student_id)
    -> VALUES ("Music", "Hip-Hop", 6);
Query OK, 1 row affected (0.00 sec)

mysql> INSERT INTO favorites (class, sport, student_id)
    -> VALUES ("Arts", "Boxing", 1);
Query OK, 1 row affected (0.00 sec)

mysql> INSERT INTO favorites (class, sport, student_id)
    -> VALUES ("Literature", "Tennis", 3);
Query OK, 1 row affected (0.00 sec)

mysql> INSERT INTO favorites (class, sport, student_id)
    -> VALUES ("Computer science", "Tennis", 5);
Query OK, 1 row affected (0.00 sec)

mysql> INSERT INTO favorites (class, sport, student_id)
    -> VALUES ("Arts", "Baseball", 4);
Query OK, 1 row affected (0.01 sec)

mysql> SELECT * FROM favorites;
+----+------------------+----------+------------+
| id | class            | sport    | student_id |
+----+------------------+----------+------------+
|  1 | Maths            | Cricket  |          2 |
|  2 | Music            | Hip-Hop  |          6 |
|  3 | Arts             | Boxing   |          1 |
|  4 | Literature       | Tennis   |          3 |
|  5 | Computer science | Tennis   |          5 |
|  6 | Arts             | Baseball |          4 |
+----+------------------+----------+------------+
6 rows in set (0.00 sec)

mysql> CREATE TABLE students_languages (
    -> id INT NOT NULL AUTO_INCREMENT,
    -> student_id INT,
    -> languages_id INT,
    -> PRIMARY KEY (id),
    -> FOREIGN KEY (student_id) REFERENCES students(id),
    -> FOREIGN KEY (languages_id) REFERENCES languages(id));
Query OK, 0 rows affected (0.03 sec)

mysql> INSERT INTO students_languages (student_id, languages_id)
    -> VALUES (1, 1);
Query OK, 1 row affected (0.00 sec)

mysql> INSERT INTO students_languages (student_id, languages_id)
    -> VALUES (1, 2);
Query OK, 1 row affected (0.01 sec)

mysql> INSERT INTO students_languages (student_id, languages_id)
    -> VALUES (2, 1);
Query OK, 1 row affected (0.00 sec)

mysql> INSERT INTO students_languages (student_id, languages_id)
    -> VALUES (2, 3);
Query OK, 1 row affected (0.00 sec)

mysql> INSERT INTO students_languages (student_id, languages_id)
    -> VALUES (3, 1);
Query OK, 1 row affected (0.00 sec)

mysql> INSERT INTO students_languages (student_id, languages_id)
    -> VALUES (4, 1);
Query OK, 1 row affected (0.00 sec)

mysql> INSERT INTO students_languages (student_id, languages_id)
    -> VALUES (4, 2);
Query OK, 1 row affected (0.00 sec)

mysql> INSERT INTO students_languages (student_id, languages_id)
    -> VALUES (4, 4);
Query OK, 1 row affected (0.00 sec)

mysql> INSERT INTO students_languages (student_id, languages_id)
    -> VALUES (4, 5);
Query OK, 1 row affected (0.00 sec)

mysql> INSERT INTO students_languages (student_id, languages_id)
    -> VALUES (5, 1);
Query OK, 1 row affected (0.00 sec)

mysql> INSERT INTO students_languages (student_id, languages_id)
    -> VALUES (5, 5);
Query OK, 1 row affected (0.00 sec)

mysql> INSERT INTO students_languages (student_id, languages_id)
    -> VALUES (6, 1);
Query OK, 1 row affected (0.00 sec)

mysql> INSERT INTO students_languages (student_id, languages_id)
    -> VALUES (6, 2);
Query OK, 1 row affected (0.01 sec)

mysql> INSERT INTO students_languages (student_id, languages_id)
    -> VALUES (6, 3);
Query OK, 1 row affected (0.00 sec)

mysql> SELECT * FROM students_languages;
+----+------------+--------------+
| id | student_id | languages_id |
+----+------------+--------------+
|  1 |          1 |            1 |
|  2 |          1 |            2 |
|  3 |          2 |            1 |
|  4 |          2 |            3 |
|  5 |          3 |            1 |
|  6 |          4 |            1 |
|  7 |          4 |            2 |
|  8 |          4 |            4 |
|  9 |          4 |            5 |
| 10 |          5 |            1 |
| 11 |          5 |            5 |
| 12 |          6 |            1 |
| 13 |          6 |            2 |
| 14 |          6 |            3 |
+----+------------+--------------+
14 rows in set (0.00 sec)

RAPPORT LEVEL 1:

mysql> SELECT * FROM students WHERE id = 3;
+----+------+-----------+
| id | name | city      |
+----+------+-----------+
|  3 | Marc | Marseille |
+----+------+-----------+
1 row in set (0.00 sec)

mysql> SELECT * FROM students WHERE id = 6;
+----+--------+-------+
| id | name   | city  |
+----+--------+-------+
|  6 | Sophie | Paris |
+----+--------+-------+
1 row in set (0.00 sec)

mysql> SELECT name, city FROM students WHERE id = 1;
+-----------+-------+
| name      | city  |
+-----------+-------+
| Véronique | Paris |
+-----------+-------+
1 row in set (0.00 sec)

mysql> SELECT name FROM students WHERE id = 2;
+---------+
| name    |
+---------+
| Steeven |
+---------+
1 row in set (0.00 sec)

mysql> SELECT * FROM students WHERE city = "Paris";
+----+-----------+-------+
| id | name      | city  |
+----+-----------+-------+
|  1 | Véronique | Paris |
|  5 | Romain    | Paris |
|  6 | Sophie    | Paris |
+----+-----------+-------+
3 rows in set (0.00 sec)

mysql> SELECT name FROM students WHERE city = "Lyon";
+---------+
| name    |
+---------+
| Steeven |
| Nour    |
+---------+
2 rows in set (0.00 sec)

RAPPORT LEVEL 2:

mysql> SELECT *
    -> FROM students
    -> INNER JOIN favorites ON favorites.student_id = students.id
    -> WHERE students.id = 5;
+----+--------+-------+----+------------------+--------+------------+
| id | name   | city  | id | class            | sport  | student_id |
+----+--------+-------+----+------------------+--------+------------+
|  5 | Romain | Paris |  5 | Computer science | Tennis |          5 |
+----+--------+-------+----+------------------+--------+------------+
1 row in set (0.00 sec)

mysql> SELECT name, favorites.sport
    -> FROM students
    -> INNER JOIN favorites ON favorites.student_id = students.id
    -> WHERE students.id = 4;
+------+----------+
| name | sport    |
+------+----------+
| Nour | Baseball |
+------+----------+
1 row in set (0.00 sec)

mysql> SELECT name, favorites.class
    -> FROM students
    -> INNER JOIN favorites ON favorites.student_id = students.id
    -> WHERE students.id = 1;
+-----------+-------+
| name      | class |
+-----------+-------+
| Véronique | Arts  |
+-----------+-------+
1 row in set (0.00 sec)

mysql> SELECT *
    -> FROM students
    -> INNER JOIN favorites ON favorites.student_id = students.id
    -> WHERE favorites.class = "Music";
+----+--------+-------+----+-------+---------+------------+
| id | name   | city  | id | class | sport   | student_id |
+----+--------+-------+----+-------+---------+------------+
|  6 | Sophie | Paris |  2 | Music | Hip-Hop |          6 |
+----+--------+-------+----+-------+---------+------------+
1 row in set (0.00 sec)

mysql> SELECT name
    -> FROM students
    -> INNER JOIN favorites ON favorites.student_id = students.id
    -> WHERE favorites.sport = "Tennis";
+--------+
| name   |
+--------+
| Marc   |
| Romain |
+--------+
2 rows in set (0.00 sec)

mysql> SELECT name
    -> FROM students
    -> INNER JOIN favorites ON favorites.student_id = students.id
    -> WHERE favorites.class = "Arts";
+-----------+
| name      |
+-----------+
| Véronique |
| Nour      |
+-----------+
2 rows in set (0.00 sec)

mysql> SELECT COUNT(*)
    -> FROM students
    -> WHERE city = "Paris";
+----------+
| COUNT(*) |
+----------+
|        3 |
+----------+
1 row in set (0.01 sec)

RAPPORT LEVEL 3:

mysql> SELECT *
    -> FROM students
    -> INNER JOIN students_languages ON students_languages.student_id = students.id
    -> INNER JOIN languages ON languages.id = students_languages.languages_id
    -> WHERE students.id = 1;
+----+-----------+-------+----+------------+--------------+----+---------+
| id | name      | city  | id | student_id | languages_id | id | name    |
+----+-----------+-------+----+------------+--------------+----+---------+
|  1 | Véronique | Paris |  1 |          1 |            1 |  1 | French  |
|  1 | Véronique | Paris |  2 |          1 |            2 |  2 | English |
+----+-----------+-------+----+------------+--------------+----+---------+
2 rows in set (0.00 sec)

mysql> SELECT *
    -> FROM students
    -> INNER JOIN students_languages ON students_languages.student_id = students.id
    -> INNER JOIN languages ON languages.id = students_languages.languages_id
    -> WHERE students.id = 4;
+----+------+------+----+------------+--------------+----+----------+
| id | name | city | id | student_id | languages_id | id | name     |
+----+------+------+----+------------+--------------+----+----------+
|  4 | Nour | Lyon |  6 |          4 |            1 |  1 | French   |
|  4 | Nour | Lyon |  7 |          4 |            2 |  2 | English  |
|  4 | Nour | Lyon |  8 |          4 |            4 |  4 | Spanish  |
|  4 | Nour | Lyon |  9 |          4 |            5 |  5 | Mandarin |
+----+------+------+----+------------+--------------+----+----------+
4 rows in set (0.00 sec)

mysql> SELECT languages.name, students.name
    -> FROM students
    -> INNER JOIN students_languages ON students_languages.student_id = students.id
    -> INNER JOIN languages ON languages.id = students_languages.languages_id
    -> WHERE students.id = 5;
+----------+--------+
| name     | name   |
+----------+--------+
| French   | Romain |
| Mandarin | Romain |
+----------+--------+
2 rows in set (0.00 sec)

RAPPORT LEVEL 4:

mysql> UPDATE students
    -> SET name = "Benoit"
    -> WHERE id = 4;
Query OK, 1 row affected (0.01 sec)
Rows matched: 1  Changed: 1  Warnings: 0

mysql> SELECT * FROM students;
+----+-----------+-----------+
| id | name      | city      |
+----+-----------+-----------+
|  1 | Véronique | Paris     |
|  2 | Steeven   | Lyon      |
|  3 | Marc      | Marseille |
|  4 | Benoit    | Lyon      |
|  5 | Romain    | Paris     |
|  6 | Sophie    | Paris     |
+----+-----------+-----------+
6 rows in set (0.00 sec)

mysql> UPDATE students
    -> SET city = "Bordeaux"
    -> WHERE id = 1;
Query OK, 1 row affected (0.00 sec)
Rows matched: 1  Changed: 1  Warnings: 0

mysql> SELECT * FROM students;
+----+-----------+-----------+
| id | name      | city      |
+----+-----------+-----------+
|  1 | Véronique | Bordeaux  |
|  2 | Steeven   | Lyon      |
|  3 | Marc      | Marseille |
|  4 | Benoit    | Lyon      |
|  5 | Romain    | Paris     |
|  6 | Sophie    | Paris     |
+----+-----------+-----------+
6 rows in set (0.00 sec)

!!
mysql> DELETE FROM students
    -> WHERE id = 2;
ERROR 1451 (23000): Cannot delete or update a parent row: a foreign key constraint fails (`school`.`favorites`, CONSTRAINT `favorites_ibfk_1` FOREIGN KEY (`student_id`) REFERENCES `students` (`id`))
!!

mysql> SELECT * FROM students
    -> WHERE name LIKE '%e%';
+----+-----------+----------+
| id | name      | city     |
+----+-----------+----------+
|  1 | Véronique | Bordeaux |
|  2 | Steeven   | Lyon     |
|  4 | Benoit    | Lyon     |
|  6 | Sophie    | Paris    |
+----+-----------+----------+
4 rows in set (0.00 sec)

mysql> SELECT students.id, students.name, favorites.sport FROM students
    -> INNER JOIN favorites ON favorites.student_id = students.id
    -> WHERE name LIKE '%e%';
+----+-----------+----------+
| id | name      | sport    |
+----+-----------+----------+
|  1 | Véronique | Boxing   |
|  2 | Steeven   | Cricket  |
|  4 | Benoit    | Baseball |
|  6 | Sophie    | Hip-Hop  |
+----+-----------+----------+
4 rows in set (0.00 sec)

mysql> SELECT students.id, students.name, favorites.class FROM students
    -> INNER JOIN favorites ON favorites.student_id = students.id
    -> WHERE city LIKE '%i%';
+----+--------+------------------+
| id | name   | class            |
+----+--------+------------------+
|  3 | Marc   | Literature       |
|  5 | Romain | Computer science |
|  6 | Sophie | Music            |
+----+--------+------------------+
3 rows in set (0.00 sec)

Bye!